{
    "name": "Stuart Herbert",
    "photo-url": "https://secure.meetupstatic.com/photos/member/b/7/2/c/highres_24046892.jpeg",
    "description": "Software industry veteran. Developer. Leader. Teacher. QA. Building quality at Ganbaro Digital.",
    "twitter-handle": "stuherbert",
    "website-url": "http://blog.stuartherbert.com/",
    "meetup-id": 25201422
}